{"architecture":{"depth":2,"latent_dim":64,"tail_head":"gpd","width":128},"configuration_id":"lemhi-a10-py311-l40-v1","configuration_sha256":"0b1115a6801259c62d9550c877a3c49a897319348ba1c2027be0d9c4f77c1179","corpus_manifest_sha256":"9de18c4822397ae8a70f827a6a0fa7649bea0c4a8314f6363716fb9bd92f46c2","family_id":"neural_point_weather_state_space_v1","model_id":"a10m5-N0-l64-w128-d2-gpd-seed147031","normalization_sha256":"bbcfa7d21d484e61cf1540cef5bfecc9d2c920cd9b2f266f405b9aa754264c74","parameter_count":56527,"pooling_class":"N0_complete","schema_version":1}
